Company_Name,Category,Address,Url
Dr. Ajay Kumar Chaudhary Clinic,Gastroenterologist,"3/173, opposite TRINKA HOTEL, Vinay Khand 3, Gomti Nagar, Lucknow, Uttar Pradesh 226010, India",https://www.google.co.kr/maps/place/Dr.+Ajay+Kumar+Chaudhary+Clinic/data=!4m5!3m4!1s0x399be2c601c5ffed:0x9ce88788422795da!8m2!3d26.8575462!4d81.0010771?authuser=0&hl=en&rclk=1
Kanpur Medical Centre Private Limited,Orthopedic surgeon,"120/500(24, Govind Nagar Rd, near J.K. Temple, Lajpat Nagar, Narainpurwa, Kanpur, Uttar Pradesh 208005, India",https://www.google.co.kr/maps/place/Kanpur+Medical+Centre+Private+Limited/data=!4m5!3m4!1s0x399c387411b6e4db:0x14555e6c6b59dc53!8m2!3d26.4716798!4d80.3037395?authuser=0&hl=en&rclk=1
Dr Mazhar Husain,Neurosurgeon,"2/182, Vishwas Khand, Gomti Nagar, Lucknow, Uttar Pradesh 226010, India",https://www.google.co.kr/maps/place/Dr+Mazhar+Husain/data=!4m5!3m4!1s0x399be2b5674f885b:0x82cb9ef2c2a96935!8m2!3d26.8628391!4d80.9884551?authuser=0&hl=en&rclk=1
Garg Orthopaedic Centre,Orthopedic surgeon,"C 397, Nirala Nagar, Near Saraswati Shishu Mandir, Lucknow, Uttar Pradesh 226020, India",https://www.google.co.kr/maps/place/Garg+Orthopaedic+Centre/data=!4m5!3m4!1s0x399bfd85cb8c5343:0xc74bfe9aa26cfa8!8m2!3d26.874846!4d80.93417?authuser=0&hl=en&rclk=1
Department of Biotechnology,Hospital department,"546/217, Sarfarazganj, Lucknow, Uttar Pradesh 226003, India",https://www.google.co.kr/maps/place/Department+of+Biotechnology/data=!4m5!3m4!1s0x399bfe20b0067d1b:0xc10351f5f5a439f1!8m2!3d26.8780035!4d80.872499?authuser=0&hl=en&rclk=1
Santosh Hospital,Doctor,"3/37, Grand Trunk Rd, Pocket J, Nehru Nagar III, Nehru Nagar, Ghaziabad, Uttar Pradesh 201001, India",https://www.google.co.kr/maps/place/Santosh+Hospital/data=!4m5!3m4!1s0x390cf1058d5f3dbd:0xe11f535b13eb141f!8m2!3d28.649194!4d77.4434655?authuser=0&hl=en&rclk=1
LifeCare Diagnostics Indira Nagar,Diagnostic center,"A-1553, A-Block, Meena Market Rd, Liberty Colony Park, Sarvodaya Nagar, Indira Nagar, Lucknow, Uttar Pradesh 226015, India",https://www.google.co.kr/maps/place/LifeCare+Diagnostics+Indira+Nagar/data=!4m5!3m4!1s0x399bfd50eb4c4203:0xd46dc6251e01fbe9!8m2!3d26.8771387!4d80.9774991?authuser=0&hl=en&rclk=1
Extra Care Physiotherapy Lucknow (Specialized In Spine Manual and Neuro Rehab ),Physical therapist,"36 Ishwarpuri (Gate No.2, behind Spencer, Sector 12, Indira Nagar, Lucknow, Uttar Pradesh 226016, India",https://www.google.co.kr/maps/place/Extra+Care+Physiotherapy+Lucknow+(Specialized+In+Spine+Manual+and+Neuro+Rehab+)/data=!4m5!3m4!1s0x399be2a4884c7fed:0xaa55f842a7bfb897!8m2!3d26.8783654!4d80.9996604?authuser=0&hl=en&rclk=1
Golaganj,,,https://www.google.co.kr/maps/place/Golaganj/data=!4m5!3m4!1s0x399bfdc0a1515c11:0x6d327ba3ff8e82ce!8m2!3d26.8530636!4d80.9205502?authuser=0&hl=en&rclk=1
Dr. Ravi Shankar Best Neurosurgeon | Brain & Spine Surgeon | Cerebrovascular Specialist | Epilepsy Surgery | Brain Tumor,Neurosurgeon,"Amar Shaheed Path, Golf City, Pocket - 1, Sector A, Lucknow, Uttar Pradesh 226002, India",https://www.google.co.kr/maps/place/Dr.+Ravi+Shankar+Best+Neurosurgeon+%7C+Brain+%26+Spine+Surgeon+%7C+Cerebrovascular+Specialist+%7C+Epilepsy+Surgery+%7C+Brain+Tumor/data=!4m5!3m4!1s0x399be535c5074f25:0xf72da9eb7e1b9501!8m2!3d26.7775755!4d80.985569?authuser=0&hl=en&rclk=1
River Bank Colony,,,https://www.google.co.kr/maps/place/River+Bank+Colony/data=!4m5!3m4!1s0x399bfd94d8f677d5:0x7f3b5a2333d3f8e3!8m2!3d26.861002!4d80.9234606?authuser=0&hl=en&rclk=1
