Company_Name,Category,Address,Url,Latitude,Longitude,Territory
RUDRA HOSPITAL ICU & NURSING HOME,Hospital,"OARNATE COMPLEX 3RD FLOOR NEAR NEW RASOI HOTEL, Kalubha Rd, Bhavnagar, Gujarat 364001, India",https://www.google.co.kr/maps/place/RUDRA+HOSPITAL+ICU+%26+NURSING+HOME/data=!4m5!3m4!1s0x395e850a10b74bab:0x1f49ad87c8f8e874!8m2!3d23.022505!4d72.5713621?authuser=0&hl=en&rclk=1,23.022505,72.5713621,Gujarat
Dr Chintan Gandhi (Gandhi Hospital),Obstetrician-gynecologist,"Yashodanand Complex, GF-FF, Taj Mohammad Khan Pathan Rd, Virat Nagar, Ahmedabad, Gujarat 380023, India",https://www.google.co.kr/maps/place/Dr+Chintan+Gandhi+(Gandhi+Hospital)/data=!4m5!3m4!1s0x395e86f6a8069e65:0x8cdb3ff140ab1f30!8m2!3d23.0291982!4d72.6447938?authuser=0&hl=en&rclk=1,23.0291982,72.6447938,Gujarat
Shree Hospital,Hospital,"362001, Nehru Park Society, Rani Sati Colony, Junagadh, Gujarat, India",https://www.google.co.kr/maps/place/Shree+Hospital/data=!4m5!3m4!1s0x395801f33f030301:0x8e24eaff9fc607fa!8m2!3d21.5217727!4d70.4538276?authuser=0&hl=en&rclk=1,21.5217727,70.4538276,Gujarat
Hridansh Maternity Hospital,Hospital,"Sherpura, Nagarkuva, Petlad, Gujarat 388450, India",https://www.google.co.kr/maps/place/Hridansh+Maternity+Hospital/data=!4m5!3m4!1s0x395e54819ddfda93:0x472eb0dfc67e87b4!8m2!3d22.484015!4d72.8014199?authuser=0&hl=en&rclk=1,22.484015,72.8014199,Gujarat
Dr. Vinay G Bhomia,Doctor,"1, Uday Park Society, Near Sunrise Park, Vastrapur, Ahmedabad, Gujarat 380015, India",https://www.google.co.kr/maps/place/Dr.+Vinay+G+Bhomia/data=!4m5!3m4!1s0x395e9ad506b764cf:0x58b5ad49693878f7!8m2!3d23.007883!4d72.5178168?authuser=0&hl=en&rclk=1,23.007883,72.5178168,Gujarat
Dr. Sunil N. Mody,Otolaryngologist,"Modi Hospital, Dr. Radhakrishnan Road, Moti Tanki Chowk, Rajkot, Gujarat 360001, India",https://www.google.co.kr/maps/place/Dr.+Sunil+N.+Mody/data=!4m5!3m4!1s0x3959ca1278f4820b:0x55a549e4a4615304!8m2!3d22.2955029!4d70.796034?authuser=0&hl=en&rclk=1,22.2955029,70.796034,Gujarat
Geeta Hospital,Doctor,"Gundala Rd, Mundra, Gujarat 370421, India",https://www.google.co.kr/maps/place/Geeta+Hospital/data=!4m5!3m4!1s0x3950d5dac420d5a3:0xb89af8aecbb00bb1!8m2!3d22.8728372!4d69.7487505?authuser=0&hl=en&rclk=1,22.8728372,69.7487505,Gujarat
Dr. Vikram I Shah - Best Orthopedic & Joint Replacement Surgeon,Orthopedic surgeon,"Sarkhej - Gandhinagar Hwy, opp. Karnavati Club, Ramdev Nagar, Ahmedabad, Gujarat 380015, India",https://www.google.co.kr/maps/place/Dr.+Vikram+I+Shah+-+Best+Orthopedic+%26+Joint+Replacement+Surgeon/data=!4m5!3m4!1s0x395e9b25174106ab:0x22aa217300abbb05!8m2!3d23.0190226!4d72.506634?authuser=0&hl=en&rclk=1,23.0190226,72.506634,Gujarat
3 by OYO - Nami Residency,·₩₩,"Hotel Nami Residency Opp. V S Hospital, Ellisbridge, Ashram Rd, Madalpur Gam, Paldi, Ahmedabad, Gujarat 380006, India",https://www.google.co.kr/maps/place/3+by+OYO+-+Nami+Residency/data=!4m5!3m4!1s0x395e8455c8c99dff:0xfd703689e87d77a2!8m2!3d23.0210131!4d72.5702772?authuser=0&hl=en&rclk=1,23.0210131,72.5702772,Gujarat
70 Degrees East,·₩₩₩,"E-201, Second Floor, Ozone Desire 100ft, Adjacent to Columbia Asia Hospital, Hebatpur Rd, Thaltej, Ahmedabad, Gujarat 380059, India",https://www.google.co.kr/maps/place/70+Degrees+East/data=!4m5!3m4!1s0x395e9ca9a7ef5c1d:0xc1c5e2d2f29f1c69!8m2!3d23.0584132!4d72.5126416?authuser=0&hl=en&rclk=1,23.0584132,72.5126416,Gujarat
Saaol Heart Center Surat (Ghododod Branch),Doctor,"G2, Shiv Kutir Appartment, Ghod Dod Road,, next to New Life Hospital, Surat, Gujarat 395001, India",https://www.google.co.kr/maps/place/Saaol+Heart+Center+Surat+(Ghododod+Branch)/data=!4m5!3m4!1s0x3be04e734b416001:0xcb4789199b60ee14!8m2!3d21.174873!4d72.811628?authuser=0&hl=en&rclk=1,21.174873,72.811628,Gujarat
