Company_Name,Category,Address,Url
NAND SPORTS & GYMS,Manufacturer,"Plot No.882-883, Near Sapra Rubber Industries Katra Mohalla, Basti Danishmandan, Basti Sheikh, Jalandhar, Punjab 144002, India",https://www.google.co.kr/maps/place/NAND+SPORTS+%26+GYMS/data=!4m5!3m4!1s0x391a5ad195555555:0x5b9ad59eee37f28f!8m2!3d31.3136247!4d75.5349485?authuser=0&hl=en&rclk=1
NATIONAL FITNESS India,Manufacturer,"Shop no. 1 , First floor, Jalandhar - Nakodar Rd, opp. Nari niketan, Jalandhar, Punjab 144002, India",https://www.google.co.kr/maps/place/NATIONAL+FITNESS+India/data=!4m5!3m4!1s0x391a438e517d68d3:0x231cc2cbe6cb0bb5!8m2!3d31.2301277!4d75.5175672?authuser=0&hl=en&rclk=1
best gym manufacture in india (BODY FIT LINE),Fitness equipment wholesaler,"leather complex, Jalandhar, Punjab 144002, India",https://www.google.co.kr/maps/place/best+gym+manufacture+in+india+(BODY+FIT+LINE)/data=!4m5!3m4!1s0x391a45ab2e151679:0x9dbb04eb32dda167!8m2!3d31.3406814!4d75.524571?authuser=0&hl=en&rclk=1
RAJPUT ENTERPRISES,Gym,"Shiv Mandir Road Katora Talab Raipur Chattisgarh, Raipur, India",https://www.google.co.kr/maps/place/RAJPUT+ENTERPRISES/data=!4m5!3m4!1s0x390fedd4b792232f:0x2b11c6d956721c9d!8m2!3d30.7161252!4d76.7380909?authuser=0&hl=en&rclk=1
V.K.FITNESS,Fitness equipment wholesaler,"Tej Mohan Nagar, Dashmesh Nagar, Jalandhar, Punjab 144410, India",https://www.google.co.kr/maps/place/V.K.FITNESS/data=!4m5!3m4!1s0x391a5bfa49562ce5:0x42422d87be0fc6de!8m2!3d31.3171985!4d75.5574592?authuser=0&hl=en&rclk=1
Fitness World Bhatinda Store,Fitness equipment wholesaler,"3217, Court Rd, Telian Wala Mohalla, Old City, Bathinda, Punjab 151001, India",https://www.google.co.kr/maps/place/Fitness+World+Bhatinda+Store/data=!4m5!3m4!1s0x390d015a3b10d9d9:0x5651549ef9c7c54b!8m2!3d30.2072006!4d74.9438105?authuser=0&hl=en&rclk=1
Pg Gym Equipment Manufacturer in Jalandhar | Punjab,Fitness equipment wholesaler,"13/178 ,basti nau , near sai dass school, jalandhar city, Punjab 144002, India",https://www.google.co.kr/maps/place/Pg+Gym+Equipment+Manufacturer+in+Jalandhar+%7C+Punjab/data=!4m5!3m4!1s0x391a5aec7902f02f:0xabf5d867003faa2b!8m2!3d31.3254429!4d75.5569647?authuser=0&hl=en&rclk=1
Grand Slam Fitness - Gym & Fitness Equipment in Mohali,Fitness equipment wholesaler,"Shopping Plaza, Shop No.66, Shivalik City, Sector 127 Kharar Landran Road, Kharar, Sahibzada Ajit Singh Nagar, Punjab 140301, India",https://www.google.co.kr/maps/place/Grand+Slam+Fitness+-+Gym+%26+Fitness+Equipment+in+Mohali/data=!4m5!3m4!1s0x390fef4fbfe7b727:0xe1bd15747fd7c658!8m2!3d30.7215537!4d76.6524921?authuser=0&hl=en&rclk=1
Treadmill Manufacturer in India | Syndicate,Exercise equipment store,"50 House no , New Rasila Nagar,Near Indo german School , Basti Danishmanda, Gakhal Main Road, jalandhar city, Punjab 144002, India",https://www.google.co.kr/maps/place/Treadmill+Manufacturer+in+India+%7C+Syndicate/data=!4m5!3m4!1s0x391a5ac5aac03791:0x77a4c7df31d34e50!8m2!3d31.318742!4d75.542141?authuser=0&hl=en&rclk=1
LA FITNESS,Fitness equipment wholesaler,"near WATER TANK, Ujala Nagar, Basti Sheikh, Jalandhar, Punjab 144002, India",https://www.google.co.kr/maps/place/LA+FITNESS/data=!4m5!3m4!1s0x391a5b6c9204dd95:0x800f8d0e96dc4a!8m2!3d31.3143417!4d75.5473213?authuser=0&hl=en&rclk=1
Imported Gym Equipments India | Syndicate,Fitness equipment wholesaler,"Basti Nau, near sai dass school, Jalandhar, Punjab 144001, India",https://www.google.co.kr/maps/place/Imported+Gym+Equipments+India+%7C+Syndicate/data=!4m5!3m4!1s0x391a5aecbb6ef4c5:0x574e737e74f388d1!8m2!3d31.327825!4d75.557634?authuser=0&hl=en&rclk=1
Viva Fitness,Exercise equipment store,"GTB Market, Shastri Nagar, Model Town, Ludhiana, Punjab 141002, India",https://www.google.co.kr/maps/place/Viva+Fitness/data=!4m5!3m4!1s0x391a83b33f982587:0x73d0c0d21e89a45c!8m2!3d30.8902325!4d75.8366452?authuser=0&hl=en&rclk=1
"GET SET SPORTS - Gym Equipment Manufacturers in Jalandhar, Punjab",Fitness equipment wholesaler,"143, NEAR CT Public School, Greater Kailash, Moti Nagar, Jalandhar, Punjab 144002, India","https://www.google.co.kr/maps/place/GET+SET+SPORTS+-+Gym+Equipment+Manufacturers+in+Jalandhar,+Punjab/data=!4m5!3m4!1s0x391a51bc377b3f5b:0xfc1d2482bede3c82!8m2!3d31.3562479!4d75.5589653?authuser=0&hl=en&rclk=1"
Atul Gym Equipments Manufacturers in India,Fitness equipment wholesaler,"127, Adarsh nagar , Jalandhar city, jalandhar city, Punjab 144002, India",https://www.google.co.kr/maps/place/Atul+Gym+Equipments+Manufacturers+in+India/data=!4m5!3m4!1s0x391a5aed496e4a5f:0x36026eda094e83a7!8m2!3d31.328838!4d75.561382?authuser=0&hl=en&rclk=1
Dumbbells manufacturer in India | Syndicate,Fitness equipment wholesaler,"23 , Basti nau, near barlaki ram and sons, jalandhar city, Punjab 144002, India",https://www.google.co.kr/maps/place/Dumbbells+manufacturer+in+India+%7C+Syndicate/data=!4m5!3m4!1s0x391a451000000017:0xe94ecef93970dd84!8m2!3d31.310181!4d75.492728?authuser=0&hl=en&rclk=1
Nova Fitness,Sporting goods store,"W.X. 80, Nijatam Nagar, Basti Nau, J.P. Nagar, Jalandhar, Punjab 144002, India",https://www.google.co.kr/maps/place/Nova+Fitness/data=!4m5!3m4!1s0x391a5a594d22b88d:0xea9fac57287a53a3!8m2!3d31.325828!4d75.559906?authuser=0&hl=en&rclk=1
Gamma Fitness,Fitness equipment wholesaler,"JRC TOWER, Nijatam Nagar, Basti Nau, Tagore Nagar, Jalandhar, Punjab 144002, India",https://www.google.co.kr/maps/place/Gamma+Fitness/data=!4m5!3m4!1s0x391a5b9c70e1e097:0xb1ba834a483908f6!8m2!3d31.323104!4d75.5640508?authuser=0&hl=en&rclk=1
Thakur fitness world,Fitness equipment wholesaler,"Thakur Complex, Lakkar Mandi Rd, Punjab Police Academy Campus, Phillaur, Punjab 144410, India",https://www.google.co.kr/maps/place/Thakur+fitness+world/data=!4m5!3m4!1s0x391a891b25827aeb:0xa52c44495b12d2fd!8m2!3d31.0205953!4d75.7854832?authuser=0&hl=en&rclk=1
Fitness World Chandigarh Store,Fitness equipment wholesaler,"139 F.F., Sector 55, Phase 1, Industrial Area Phase I, Chandigarh, 160001, India",https://www.google.co.kr/maps/place/Fitness+World+Chandigarh+Store/data=!4m5!3m4!1s0x3bcb98bffab2b459:0x43baf100ec48c10e!8m2!3d30.754169!4d76.7704733?authuser=0&hl=en&rclk=1
Bull Rage India Inc. - Gym Machine Manufacturer,Exporter,"Near, Basti Danishmanda chowk, Basti Sheikh, Jalandhar, Punjab 144002, India",https://www.google.co.kr/maps/place/Bull+Rage+India+Inc.+-+Gym+Machine+Manufacturer/data=!4m5!3m4!1s0x391a5a98a2d474af:0xd84f32c1a1c89f12!8m2!3d31.3127084!4d75.5277821?authuser=0&hl=en&rclk=1
ANSONN Fitness Equipments,Exercise equipment store,"ground floor 7 basti nau near sahni sports, near hindon sports shop, Punjab 144001, India",https://www.google.co.kr/maps/place/ANSONN+Fitness+Equipments/data=!4m5!3m4!1s0x391a5bae4e9b3cb7:0x5b123df9806a7da3!8m2!3d31.3239004!4d75.557449?authuser=0&hl=en&rclk=1
BODYLEAN FITNESS,Fitness equipment wholesaler,"BODYLEAN HOUSE, GOLDEN MARKET, AMBEDKAR NAGAR, Basti Nau, Jalandhar, Punjab 144004, India",https://www.google.co.kr/maps/place/BODYLEAN+FITNESS/data=!4m5!3m4!1s0x391a5b3108a0d0bf:0x4028d46bd2233e3d!8m2!3d31.3268251!4d75.5545433?authuser=0&hl=en&rclk=1
FRIENDS TRADING CO. - [ Gym Equipment ],Fitness equipment wholesaler,"W.X.18, opposite Guru Nanak Dev University College, Basti Nau, Ashok Nagar, Jalandhar, Punjab 144002, India",https://www.google.co.kr/maps/place/FRIENDS+TRADING+CO.+-+%5B+Gym+Equipment+%5D/data=!4m5!3m4!1s0x391a5a594d22b88d:0xd434674698b53e98!8m2!3d31.3253102!4d75.5588181?authuser=0&hl=en&rclk=1
J.k Fitness Hub,Gymnastics club,"120, Fit Rd, Dilbagh Nagar, Jalandhar, Punjab 144002, India",https://www.google.co.kr/maps/place/J.k+Fitness+Hub/data=!4m5!3m4!1s0x391a5abf4955932f:0x3b450934b3d9eb3d!8m2!3d31.3284922!4d75.5455055?authuser=0&hl=en&rclk=1
Gym manufacturer in india,Exercise equipment store,"Nijatam Nagar, Basti Nau, Ashok Nagar, Jalandhar, Punjab 144002, India",https://www.google.co.kr/maps/place/Gym+manufacturer+in+india/data=!4m5!3m4!1s0x391a5a594f7d2cb9:0xc9c3a54a70b66ade!8m2!3d31.323846!4d75.557601?authuser=0&hl=en&rclk=1
Maxpower Gym Equipment,Fitness equipment wholesaler,"107, Raj Nagar, Basti Bawa Khel, Jalandhar, Punjab 144021, India",https://www.google.co.kr/maps/place/Maxpower+Gym+Equipment/data=!4m5!3m4!1s0x391a5b1f52e1be59:0x129bae0bf93821dc!8m2!3d31.3380851!4d75.5463076?authuser=0&hl=en&rclk=1
National Sports & Games,Fitness equipment wholesaler,"194, Mahavir Marg, opposite Chick Chick House, Adarsh Nagar, Jalandhar, Punjab 144001, India",https://www.google.co.kr/maps/place/National+Sports+%26+Games/data=!4m5!3m4!1s0x391a5a8d49fda14b:0x62319a5a56f7d829!8m2!3d31.32993!4d75.5640522?authuser=0&hl=en&rclk=1
Commando Health Gym,Gymnasium Cz,"4FFF+9H5, Khiwa, Nakodar, Punjab 144040, India",https://www.google.co.kr/maps/place/Commando+Health+Gym/data=!4m5!3m4!1s0x391a69aeb5aaaaab:0xd9ef0b1df1f010c9!8m2!3d31.1233799!4d75.4739794?authuser=0&hl=en&rclk=1
Royal Fitness,Manufacturer,"no 1, Green Ave, near shoor market, Dada Nagar, Model Town, Jalandhar, Punjab 144003, India",https://www.google.co.kr/maps/place/Royal+Fitness/data=!4m5!3m4!1s0x391a5b46526715c3:0x4a16dce0fbc3bf9e!8m2!3d31.2996262!4d75.5786248?authuser=0&hl=en&rclk=1
Gamma Fitness,Wholesaler,"152/1, Road, Guru Sant Nagar, Kostadir, Jalandhar, Punjab 144003, India",https://www.google.co.kr/maps/place/Gamma+Fitness/data=!4m5!3m4!1s0x391a5b29765f7641:0xfeac6e8a2c3cf85b!8m2!3d31.311134!4d75.543867?authuser=0&hl=en&rclk=1
Acme Gym,Gym,"H324+PRR, New Housing Board Colony, Housing Board Colony, Sirsa, Haryana 125055, India",https://www.google.co.kr/maps/place/Acme+Gym/data=!4m5!3m4!1s0x39114d22b49337bf:0xe38a16df78fb2744!8m2!3d29.5518532!4d75.0570035?authuser=0&hl=en&rclk=1
Afton Treadmill & Gym Equipment Store,Exercise equipment store,"SCF-19 Bharat Nagar Market, Bibi Wala Road, Near Bibi Wala Chowk,, Bibi Wala, Bathinda, Punjab 151001, India",https://www.google.co.kr/maps/place/Afton+Treadmill+%26+Gym+Equipment+Store/data=!4m5!3m4!1s0x3910ccdfaaaaaac3:0x60e4b55c38ad4809!8m2!3d30.254884!4d74.98809?authuser=0&hl=en&rclk=1
Pandey fitness hub,Fitness equipment wholesaler,"1, Jalandhar, Punjab 144002, India",https://www.google.co.kr/maps/place/Pandey+fitness+hub/data=!4m5!3m4!1s0x391a5b0f0c4b90e3:0xa164286911c8e9d!8m2!3d31.3101807!4d75.4927278?authuser=0&hl=en&rclk=1
Afton Fitness Equipment,Exercise equipment store,"Basti Sheikh Rd, Basti Nau, Ashok Nagar, Jalandhar, Punjab 144002, India",https://www.google.co.kr/maps/place/Afton+Fitness+Equipment/data=!4m5!3m4!1s0x391a5ad1e5555555:0xd8f605109ac68f61!8m2!3d31.3222446!4d75.5570768?authuser=0&hl=en&rclk=1
"V S International , Fitness Equipment Manufacturers in Jalandhar, Punjab",Corporate office,"PLOT NO A-4, LEFT SIDE GALI NO 3, SANGAL SOHAL ROAD BASTI PEER DAD, Leather Complex Rd, ADJOINING, Jalandhar, Punjab 144021, India","https://www.google.co.kr/maps/place/V+S+International+,+Fitness+Equipment+Manufacturers+in+Jalandhar,+Punjab/data=!4m5!3m4!1s0x391a4546839f1795:0x74b73313ef2ee530!8m2!3d31.329028!4d75.5125305?authuser=0&hl=en&rclk=1"
PARAM SPORTS AND FITNESS,Fitness equipment wholesaler,"224, New Shivaji Nagar, Basti Danish Manda, Basti Shekh Darwesh, BASTI DANISHMANDAN, Jalandhar, Punjab 144002, India",https://www.google.co.kr/maps/place/PARAM+SPORTS+AND+FITNESS/data=!4m5!3m4!1s0x391a5b80fa546ce7:0xf66321fe59c34a6!8m2!3d31.3132001!4d75.540364?authuser=0&hl=en&rclk=1
Tara Fitness Products,Manufacturer,tarafitnessproducts.com,https://www.google.co.kr/maps/place/Tara+Fitness+Products/data=!4m5!3m4!1s0x391a5a8095555555:0xec50d78a9901deae!8m2!3d21.1337907!4d82.778933?authuser=0&hl=en&rclk=1
Gym Equipments Manufacturer - Barna Sports,Fitness equipment wholesaler,"222, Nahal Road, Vill, Nahal, Jalandhar, Punjab 144002, India",https://www.google.co.kr/maps/place/Gym+Equipments+Manufacturer+-+Barna+Sports/data=!4m5!3m4!1s0x391a5b98b816d9c1:0xdb37bcfafe4d46c0!8m2!3d31.3204799!4d75.5344646?authuser=0&hl=en&rclk=1
Harry Fitness Guru,Lodging,"House No, WP 90, Basti Sheikh, Jalandhar, Punjab 144002, India",https://www.google.co.kr/maps/place/Harry+Fitness+Guru/data=!4m5!3m4!1s0x391a5bac676840d3:0x402042ddedcad539!8m2!3d31.3179478!4d75.5527921?authuser=0&hl=en&rclk=1
Veneet sports goods,Fitness equipment wholesaler,"224/ new sant nagar, Basti Sheikh Rd, Near gulshan kariana store, Jalandhar, Punjab 144002, India",https://www.google.co.kr/maps/place/Veneet+sports+goods/data=!4m5!3m4!1s0x391a5bda1bd6a5a3:0xc5693b0f2ccd7aec!8m2!3d31.3143465!4d75.5592192?authuser=0&hl=en&rclk=1
Punjab Health Club,Gymnastics club,"Sekha Rd, near dj blast, Barnala, Punjab 148101, India",https://www.google.co.kr/maps/place/Punjab+Health+Club/data=!4m5!3m4!1s0x3910f22575881ae3:0x36ec79567d88ab50!8m2!3d30.3712715!4d75.5613792?authuser=0&hl=en&rclk=1
Herbalife Body Fitness Club,Natural goods store,"36, Ward No. 1, Near Anaj Mandi, Ghanaur, Punjab 140702, India",https://www.google.co.kr/maps/place/Herbalife+Body+Fitness+Club/data=!4m5!3m4!1s0x390fd1b40770f847:0xb19f3582f7f2bfad!8m2!3d30.3356021!4d76.6124424?authuser=0&hl=en&rclk=1
Gym,Gymnastics club,"Garhi Bakhsha, Punjab 144001, India",https://www.google.co.kr/maps/place/Gym/data=!4m5!3m4!1s0x391a53c8ba3eeabd:0x59113297943b1d02!8m2!3d31.5016365!4d75.6196157?authuser=0&hl=en&rclk=1
Barna Sports - Gym equipment manufacturers,Fitness equipment wholesaler,"plot no. 55, mera garden, Jalandhar, Punjab 144002, India",https://www.google.co.kr/maps/place/Barna+Sports+-+Gym+equipment+manufacturers/data=!4m5!3m4!1s0x391a5b2b54270211:0x4287e06993a58ae7!8m2!3d31.3222022!4d75.5323084?authuser=0&hl=en&rclk=1
Pan International (KOBO),Fitness equipment wholesaler,"Kapurthala Rd, Raj Nagar, Basti Bawa Khel, Jalandhar, Punjab 144021, India",https://www.google.co.kr/maps/place/Pan+International+(KOBO)/data=!4m5!3m4!1s0x391a5b7dd3f5b0ad:0xb5aa66ea8fa73f17!8m2!3d31.3401624!4d75.5322801?authuser=0&hl=en&rclk=1
