Company_Name,Category,Address,Url
Fitness India Gym & Slimming Center,Gym,"Thind Complex, Jassian Rd, Durga Puri, Haibowal Kalan, Ludhiana, Punjab 141001, India",https://www.google.co.kr/maps/place/Fitness+India+Gym+%26+Slimming+Center/data=!4m5!3m4!1s0x391a83fa3a26ce8b:0xdea1e126cb02d987!8m2!3d30.9251601!4d75.8164674?authuser=0&hl=en&rclk=1
PD FITNESS GYM,Gym,"2nd Floor, Mithapur Rd, above State Bank of India, Ravindra Nagar, Jalandhar, Punjab 144001, India",https://www.google.co.kr/maps/place/PD+FITNESS+GYM/data=!4m5!3m4!1s0x391a5b16968d4fef:0x4ca9df16376870fa!8m2!3d31.2841923!4d75.5786732?authuser=0&hl=en&rclk=1
Punjab Health Club,Gym,"Satguru Kabir Chowk, Tower Enclave, Khurla Kingra, Jalandhar, Punjab 144003, India",https://www.google.co.kr/maps/place/Punjab+Health+Club/data=!4m5!3m4!1s0x391a5b1a019d07f3:0x42fb613ede6d2957!8m2!3d31.2954469!4d75.5569552?authuser=0&hl=en&rclk=1
Prime Fitness unisex gym,Fitness center,"Jalandhar road, Opp petrol pump, above PNB bank, Mansoorwal dona, Kapurthala, Punjab 144601, India",https://www.google.co.kr/maps/place/Prime+Fitness+unisex+gym/data=!4m5!3m4!1s0x391a48e415f61aeb:0x762efa1d6ac1ff5d!8m2!3d31.3713!4d75.404179?authuser=0&hl=en&rclk=1
Sukhija Slimming & Fitness Centre,Gym,"Sukhija Colony Rose Enclave Street, opposite to temple, Punjab 151203, India",https://www.google.co.kr/maps/place/Sukhija+Slimming+%26+Fitness+Centre/data=!4m5!3m4!1s0x391759cab15de149:0x3b365b52fa22a6e8!8m2!3d30.6754191!4d74.763356?authuser=0&hl=en&rclk=1
The Code Fitness Premium - Best Premium Gym In Ludhiana,Gym,"4th Floor, Boulevard Mall, The Mall Rd, Ludhiana, Punjab 141001, India",https://www.google.co.kr/maps/place/The+Code+Fitness+Premium+-+Best+Premium+Gym+In+Ludhiana/data=!4m5!3m4!1s0x391a83b9016025f9:0xdf3f31078183ce17!8m2!3d30.9056601!4d75.8400872?authuser=0&hl=en&rclk=1
Muscle Town,Fitness center,"SC0 51-52, 1st Floor, Tower, Opp. Ang Tower, Urban Estate phase II, Jalandhar, Punjab 144022, India",https://www.google.co.kr/maps/place/Muscle+Town/data=!4m5!3m4!1s0x391a5bbaea95c5ef:0xba77596411ada79c!8m2!3d31.2971774!4d75.5874142?authuser=0&hl=en&rclk=1
Neo Fitness - Best GYM & Fitness Centre in Jalandhar,Gym,"# 689-R, 2nd Floor, No Exit, Mall Rd, Model Town, Jalandhar, Punjab 144003, India",https://www.google.co.kr/maps/place/Neo+Fitness+-+Best+GYM+%26+Fitness+Centre+in+Jalandhar/data=!4m5!3m4!1s0x391a5ba6612fc121:0x387769d2059cdd8e!8m2!3d31.3099884!4d75.5788383?authuser=0&hl=en&rclk=1
Fitness World (Gym),Gym,"Dehlon-Sahnewal Rd, Punjab 141101, India",https://www.google.co.kr/maps/place/Fitness+World+(Gym)/data=!4m5!3m4!1s0x39107a2c29d70dc9:0x1b759d8dc7726855!8m2!3d30.7486525!4d75.8591916?authuser=0&hl=en&rclk=1
F360 Gym Ludhiana,Gym,"367, Chandigarh Road, opp. Gopichand, Roshan Lal Petrol Pump, Ludhiana, Punjab 141014, India",https://www.google.co.kr/maps/place/F360+Gym+Ludhiana/data=!4m5!3m4!1s0x391a8319a6ebe855:0xb705def98b1c98d4!8m2!3d30.90957!4d75.88303?authuser=0&hl=en&rclk=1
Fitness Zone Gym,Fitness center,"Bank of India basement near easy day, Mithapur Rd, Cheema Nagar, Jalandhar, Punjab, India",https://www.google.co.kr/maps/place/Fitness+Zone+Gym/data=!4m5!3m4!1s0x391a5ba22bb213c3:0x76b0cd05bcd9860b!8m2!3d31.2918651!4d75.5804296?authuser=0&hl=en&rclk=1
Fitness Just Gym- Kapurthala,Fitness center,"Green Model Town, Kanjli Road, near Radha Swami Satsang Dera, Kapurthala, Punjab 144601, India",https://www.google.co.kr/maps/place/Fitness+Just+Gym-+Kapurthala/data=!4m5!3m4!1s0x391a48fbffffffff:0x35ab1f628dd0fea!8m2!3d31.3980957!4d75.3869803?authuser=0&hl=en&rclk=1
HEAT Fitness India,Gym,"Pakhowal Rd, New Moti Bagh Colony, Phullanwal, Ludhiana, Punjab 141002, India",https://www.google.co.kr/maps/place/HEAT+Fitness+India/data=!4m5!3m4!1s0x391a822421afc18b:0x1684aea7b1df1819!8m2!3d30.8707655!4d75.8127102?authuser=0&hl=en&rclk=1
Auragymz - Best Gym | Top Gym in Ludhiana,Gym,"Opposite G.S Memorial School odhi Club Road, New BRS Nagar, Ludhiana, Punjab 141022, India",https://www.google.co.kr/maps/place/Auragymz+-+Best+Gym+%7C+Top+Gym+in+Ludhiana/data=!4m5!3m4!1s0x391a818674b7bf23:0xe34a94b1c69484e8!8m2!3d30.8757819!4d75.8004284?authuser=0&hl=en&rclk=1
Gold's Gym,Gym,"5th Floor, Rampaa Centre Point, above KFC Restaurant, Model Town, Jalandhar, Punjab 144003, India",https://www.google.co.kr/maps/place/Gold's+Gym/data=!4m5!3m4!1s0x391a5baae25572cb:0x7f5d5f0b435b45a5!8m2!3d31.3066084!4d75.5770232?authuser=0&hl=en&rclk=1
City Gym,Gym,"GWG8+X8H, Krishna Nagar, Hoshiarpur, Punjab 146001, India",https://www.google.co.kr/maps/place/City+Gym/data=!4m5!3m4!1s0x391ae2d8c0035693:0x873f442e38a8ae09!8m2!3d31.5274349!4d75.9158603?authuser=0&hl=en&rclk=1
Fitness Paradise Gym,Gym,"Grand Trunk Rd, Anant Nagar, Khanna, Punjab 141401, India",https://www.google.co.kr/maps/place/Fitness+Paradise+Gym/data=!4m5!3m4!1s0x39100e284f55ef63:0x25aec293479e6cb5!8m2!3d30.707157!4d76.2154302?authuser=0&hl=en&rclk=1
Body Zone Gym Private Limited,Gym,"1, Cool Road, Jyoti Nagar, Jalandhar, Punjab 144001, India",https://www.google.co.kr/maps/place/Body+Zone+Gym+Private+Limited/data=!4m5!3m4!1s0x391a5a594d22b88d:0xae5bca33c7ae87!8m2!3d31.3038815!4d75.5861942?authuser=0&hl=en&rclk=1
Fit & Fine Fitness Centre-Best Ladies Gym In Hoshiarpur,Gym,"SCF 23-D.Above More Store,Mall Store, Near Shimla Pahadi Chowk, Hoshiarpur, Punjab 146001, India",https://www.google.co.kr/maps/place/Fit+%26+Fine+Fitness+Centre-Best+Ladies+Gym+In+Hoshiarpur/data=!4m5!3m4!1s0x391ae2dc5a5a7acf:0xf874d1ee2c0ce3c5!8m2!3d31.5342782!4d75.9193218?authuser=0&hl=en&rclk=1
Fitness Zone Gym,Gym,"Basment Bank of india ..Unnamed Road, Gurmeet Nagar, Makhan Shah Lubana Nagar, Phase 2, Urban Estate phase II, Jalandhar, Punjab 144003, India",https://www.google.co.kr/maps/place/Fitness+Zone+Gym/data=!4m5!3m4!1s0x391a5b7c05157ce5:0xfcdafe477add84bd!8m2!3d31.2918012!4d75.5806187?authuser=0&hl=en&rclk=1
Sahil Fitness Center,Gym,"666, Jail Rd, Sector 68, Sector 69, Sahibzada Ajit Singh Nagar, Punjab 160062, India",https://www.google.co.kr/maps/place/Sahil+Fitness+Center/data=!4m5!3m4!1s0x390feea221de1785:0x73375390bf2054a4!8m2!3d30.6915932!4d76.7266298?authuser=0&hl=en&rclk=1
Pro Fitness Gym,Gym,"Rajguru Nagar Rd, Rajguru Nagar, Ludhiana, Punjab 141012, India",https://www.google.co.kr/maps/place/Pro+Fitness+Gym/data=!4m5!3m4!1s0x391a819ecb921f71:0x782d297023980ac9!8m2!3d30.8782603!4d75.7876744?authuser=0&hl=en&rclk=1
Fitness trainer,Fitness center,"Punjab bhani shabi, Bhaini Sahib, Rattangarh, Punjab 141126, India",https://www.google.co.kr/maps/place/Fitness+trainer/data=!4m5!3m4!1s0x391a9fa5b2d0e07b:0x23abad9ff7f919c5!8m2!3d30.8739509!4d76.0632546?authuser=0&hl=en&rclk=1
Sachdeva Fitness Center,Gymnasium Cz,"Sachdeva fitness centre, BAGHI ROAD, Model Town, Firozpur, Punjab 152002, India",https://www.google.co.kr/maps/place/Sachdeva+Fitness+Center/data=!4m5!3m4!1s0x3919e995307b65e5:0xc7077d0f82e0392e!8m2!3d30.9517414!4d74.6171706?authuser=0&hl=en&rclk=1
Midsity Gym & Spa,Gym,"1st floor, Sidhu Complex, Opp Bank of India Lane, Kochar Market Rd, Ludhiana, Punjab 141002, India",https://www.google.co.kr/maps/place/Midsity+Gym+%26+Spa/data=!4m5!3m4!1s0x391a83fcd2ee4349:0xe2955f331b61dd27!8m2!3d30.8961442!4d75.8379743?authuser=0&hl=en&rclk=1
Tara Gym,Gym,"Ajit palace, Jalandhar Cantt, Jalandhar, Punjab 144024, India",https://www.google.co.kr/maps/place/Tara+Gym/data=!4m5!3m4!1s0x391a595ee0536c67:0x46b5c86239607953!8m2!3d31.287465!4d75.6438297?authuser=0&hl=en&rclk=1
Level Xtreme Gym,Gym,"Street Number 12, Guru Nanak Nagar Above State Bank of India, Punjab 147003, India",https://www.google.co.kr/maps/place/Level+Xtreme+Gym/data=!4m5!3m4!1s0x39102867baa1d421:0x5abd9f4559cc01e9!8m2!3d30.3453308!4d76.4195184?authuser=0&hl=en&rclk=1
Angel World Gym & fitness academy,Gym,"Mall Rd, Sukhjit Nagar, Shivaji Nagar, The mall, Punjab 144602, India",https://www.google.co.kr/maps/place/Angel+World+Gym+%26+fitness+academy/data=!4m5!3m4!1s0x391a49abcb3c267b:0xaf803035a9b3446a!8m2!3d31.38106!4d75.3836464?authuser=0&hl=en&rclk=1
Anytime Fitness,Gym,"1st floor Plot no.11 E & 12 E, Malhar Cinema Rd, Sarabha Nagar, Ludhiana, Punjab 141001, India",https://www.google.co.kr/maps/place/Anytime+Fitness/data=!4m5!3m4!1s0x391a83ceed1aaaab:0x862f7e09abc0679e!8m2!3d30.8946629!4d75.8222997?authuser=0&hl=en&rclk=1
Indian fitness gym,Gym,"Anngarh Rd, Anngarh, Bharariwal, Amritsar, Punjab 143006, India",https://www.google.co.kr/maps/place/Indian+fitness+gym/data=!4m5!3m4!1s0x39197bc9fa130fdd:0xdea68f1fcc8f5ae0!8m2!3d31.6078375!4d74.8579461?authuser=0&hl=en&rclk=1
Olympia Fitness Planet,Nutritionist,"1798/1 Near, PAU Rd, Maharaj Nagar, Ludhiana, Punjab 141001, India",https://www.google.co.kr/maps/place/Olympia+Fitness+Planet/data=!4m5!3m4!1s0x391a83dacecb2a79:0xa35d67f98cc94928!8m2!3d30.9000276!4d75.8180686?authuser=0&hl=en&rclk=1
Neo Fitness(Best Gym In Hoshiarpur),Gym,"PCR Tower,Opp Easyday, The Mall Road, Hoshiarpur, Punjab 146001, India",https://www.google.co.kr/maps/place/Neo+Fitness(Best+Gym+In+Hoshiarpur)/data=!4m5!3m4!1s0x391ae2de83650d5b:0x432c1d5b4ca69dea!8m2!3d31.5317064!4d75.9196952?authuser=0&hl=en&rclk=1
ALERT GYM,Gym,"Nh 703a, Kala Sanghian-Lohian Khas Rd, Rampur Jagir, Punjab 144620, India",https://www.google.co.kr/maps/place/ALERT+GYM/data=!4m5!3m4!1s0x391a3e7cef6cfe4f:0x9f137940cad9748b!8m2!3d31.178618!4d75.2576187?authuser=0&hl=en&rclk=1
The Code Fitness Mohali,Gym,"SCO 112 to 114, Phase 10, Sector 64, Sahibzada Ajit Singh Nagar, Punjab 160062, India",https://www.google.co.kr/maps/place/The+Code+Fitness+Mohali/data=!4m5!3m4!1s0x390fed7f325cad7d:0x1dd879a1513f79b5!8m2!3d30.6839207!4d76.7421504?authuser=0&hl=en&rclk=1
Fitness centre,Gym,"9MV5+89R, Madara, Punjab 144025, India",https://www.google.co.kr/maps/place/Fitness+centre/data=!4m5!3m4!1s0x391a570e54e8b61b:0xa30d484d4ac37a9!8m2!3d31.3933601!4d75.6583967?authuser=0&hl=en&rclk=1
Ultimate Fitness Gym,Gym,"SCO 513, 514,515, near Reliance Fresh, Sector 70, Sahibzada Ajit Singh Nagar, Punjab 160071, India",https://www.google.co.kr/maps/place/Ultimate+Fitness+Gym/data=!4m5!3m4!1s0x390fee9115555535:0x41277ee3a9408bcd!8m2!3d30.6976053!4d76.7219453?authuser=0&hl=en&rclk=1
Super Fitness Gym Women's,Gym,"1st Floor, Above Central Bank, Tahli Wala Chowk, Sultanwind Road, Amritsar, Punjab 143001, India",https://www.google.co.kr/maps/place/Super+Fitness+Gym+Women's/data=!4m5!3m4!1s0x39197cbb06fdfac7:0xbb670627691f577a!8m2!3d31.615487!4d74.888537?authuser=0&hl=en&rclk=1
Thakur Fitness World Pvt.Ltd,Gym,"Lakkar Mandi Rd, Abad Pura, Phillaur, Punjab 144410, India",https://www.google.co.kr/maps/place/Thakur+Fitness+World+Pvt.Ltd/data=!4m5!3m4!1s0x391a89578f43495b:0xc1591199e3a7f9d0!8m2!3d31.0219693!4d75.7862239?authuser=0&hl=en&rclk=1
B.S. Basra Unisex Gym,Gym,"Pathankot Rd, 23 New Colony, Aman Nagar, Jalandhar, Punjab 144003, India",https://www.google.co.kr/maps/place/B.S.+Basra+Unisex+Gym/data=!4m5!3m4!1s0x391a5a773617182f:0xd856ac47b50cd698!8m2!3d31.3494045!4d75.587371?authuser=0&hl=en&rclk=1
Invoke Fitness,Gym,"Raja Garden Rd, Preet Nagar, Ludhiana, Punjab 141012, India",https://www.google.co.kr/maps/place/Invoke+Fitness/data=!4m5!3m4!1s0x391a81dcc1a96895:0xc10fe7907604df12!8m2!3d30.8821244!4d75.7693597?authuser=0&hl=en&rclk=1
Fitness Hangover,Gym,"1060, G.T. Road, Near India Gate, Chheharta, Amritsar, Punjab 143001, India",https://www.google.co.kr/maps/place/Fitness+Hangover/data=!4m5!3m4!1s0x39196557a87f4a8f:0x8a8a53abf18ff392!8m2!3d31.626222!4d74.783284?authuser=0&hl=en&rclk=1
fitness centre,Gym,"vill, Khosa, Punjab, India",https://www.google.co.kr/maps/place/fitness+centre/data=!4m5!3m4!1s0x391a163d4cfa7c45:0x81f55c55a349a40d!8m2!3d31.1236207!4d75.2304197?authuser=0&hl=en&rclk=1
Dhillon Muscular Gym & Fitness Planet,Gym,"Bibi Wala Rd, Bharat Nagar, Bathinda, Punjab 151001, India",https://www.google.co.kr/maps/place/Dhillon+Muscular+Gym+%26+Fitness+Planet/data=!4m5!3m4!1s0x391732b9f6d5dc53:0xb1f0b3bf117c1559!8m2!3d30.2203989!4d74.9551943?authuser=0&hl=en&rclk=1
"Burn Gym, Model Town, Jalandhar",Gym,"Satya Sai Tower, Plot No - 687 L, Model Town, Jalandhar, Punjab 144003, India","https://www.google.co.kr/maps/place/Burn+Gym,+Model+Town,+Jalandhar/data=!4m5!3m4!1s0x391a5babd7552bfd:0x7ecc792c21d21794!8m2!3d31.3071915!4d75.5755123?authuser=0&hl=en&rclk=1"
Dhawan Fitness centre,Gym,"C24C+PV8, Sangam Education Welfare Society, Fazilka, Punjab 152123, India",https://www.google.co.kr/maps/place/Dhawan+Fitness+centre/data=!4m5!3m4!1s0x3917907dbdb67db7:0xb82066c5f55bde6a!8m2!3d30.4067949!4d74.0221979?authuser=0&hl=en&rclk=1
FITNESS TOWN GYM,Gym,"66-Feet, Nakodar Link Road, Near Sant Sampla Service Station, Sofi Pind M : 83607-25031, 79733-88110, Jalandhar Cantt, Jalandhar, Punjab 144024, India",https://www.google.co.kr/maps/place/FITNESS+TOWN+GYM/data=!4m5!3m4!1s0x391a59c677799dd9:0xd0a30767c4833971!8m2!3d31.2709242!4d75.6389497?authuser=0&hl=en&rclk=1
The Fitness Hub,Gym,"DMC Rd, Block-B, Udham Singh Nagar, Tagore Nagar, Ludhiana, Punjab 141001, India",https://www.google.co.kr/maps/place/The+Fitness+Hub/data=!4m5!3m4!1s0x391a83e84e99562f:0xdea1b14e08d9519b!8m2!3d30.9117154!4d75.8210492?authuser=0&hl=en&rclk=1
Gold's Gym,Gym,"3rd Floor, GK Mall, Ludhiana Bypass Road, Jawadi Bridge, Ludhiana, Punjab 141013, India",https://www.google.co.kr/maps/place/Gold's+Gym/data=!4m5!3m4!1s0x391a82345e1745e7:0xf89c61e70eabd5e1!8m2!3d30.883168!4d75.830321?authuser=0&hl=en&rclk=1
Curl Gym,Gym,"Sainik Vihar, Kaki Pind, Jalandhar, Punjab 144007, India",https://www.google.co.kr/maps/place/Curl+Gym/data=!4m5!3m4!1s0x391a59be06d7771f:0xc211e85082eb8dc6!8m2!3d31.316525!4d75.631409?authuser=0&hl=en&rclk=1
Nandra Fitness,Gym,"Factory EG 1/9,Link Nagar,Ladowali Road, Jalandhar, Punjab 144008, India",https://www.google.co.kr/maps/place/Nandra+Fitness/data=!4m5!3m4!1s0x391a5a333778d67f:0x1b9b1093ab49f763!8m2!3d31.312923!4d75.605346?authuser=0&hl=en&rclk=1
Pulse 180 Fitness Lounge,Gym,"Block G, Sco-41F, BRS Nagar Main Rd, Defence Colony, Bhai Randhir Singh Nagar, Ludhiana, Punjab 141001, India",https://www.google.co.kr/maps/place/Pulse+180+Fitness+Lounge/data=!4m5!3m4!1s0x391a81f29927174d:0x26b92f7813c32181!8m2!3d30.8869875!4d75.8033397?authuser=0&hl=en&rclk=1
Champion Health Club,Gym,"86 Satnam Nagar, near Guru Teg Bahadur Nagar, Jalandhar, Punjab 144003, India",https://www.google.co.kr/maps/place/Champion+Health+Club/data=!4m5!3m4!1s0x391a5b00b8452431:0xca458cef6ccbe9e5!8m2!3d31.3034301!4d75.5728752?authuser=0&hl=en&rclk=1
"Burn Gym, Ghumar Mandi, Ludhiana",Gym,"Plot no B-19/186 3rd-4th Floor Rani Jhasi Road , Ghumar Mandi, Ludhiana, Punjab 141001, India","https://www.google.co.kr/maps/place/Burn+Gym,+Ghumar+Mandi,+Ludhiana/data=!4m5!3m4!1s0x391a83be8349133b:0x7ab63b03b012d839!8m2!3d30.9079654!4d75.8355701?authuser=0&hl=en&rclk=1"
Fitness World,Fitness center,"SCO 83, first and second floor, Sector 91, Sahibzada Ajit Singh Nagar, Punjab 140307, India",https://www.google.co.kr/maps/place/Fitness+World/data=!4m5!3m4!1s0x390fef024289fa99:0xe5d6bfa2654bb569!8m2!3d30.7004264!4d76.6793375?authuser=0&hl=en&rclk=1
THE EDGE PRO FITNESS GYMS,Gym,"Sutheri Road, opp icici bank, near miraz cinemaz, Hoshiarpur, Punjab 146001, India",https://www.google.co.kr/maps/place/THE+EDGE+PRO+FITNESS+GYMS/data=!4m5!3m4!1s0x391ae2d6ed0a40e9:0xefead77992669407!8m2!3d31.5286167!4d75.9073329?authuser=0&hl=en&rclk=1
THE URBAN GYM,Gym,"SCO-13, Phase II Main Rd, Urban Estate Phase II, Urban Estate, Patiala, Punjab 147002, India",https://www.google.co.kr/maps/place/THE+URBAN+GYM/data=!4m5!3m4!1s0x39102816aa7d60f5:0xf10eedc9f1d8e63c!8m2!3d30.3507177!4d76.4390864?authuser=0&hl=en&rclk=1
Xtreme Fitness Gym,Gym,"Jalandhar - Nakodar Rd, Opposite PNB Bank, Lambra, Bhagwanpur, Jalandhar, Punjab 144026, India",https://www.google.co.kr/maps/place/Xtreme+Fitness+Gym/data=!4m5!3m4!1s0x391a5cab9eed8461:0xa003a37a91256482!8m2!3d31.2541367!4d75.5308227?authuser=0&hl=en&rclk=1
B24 Fitness and Spa,Gym,"opp. GNDU campus and stadium, Pathankot, Punjab 145001, India",https://www.google.co.kr/maps/place/B24+Fitness+and+Spa/data=!4m5!3m4!1s0x391c7ffd3586fe35:0xedfb33900e4e1215!8m2!3d32.2900701!4d75.6612037?authuser=0&hl=en&rclk=1
"Breathe Gym, Jalandhar",Gym,"Hotel Inderprasth, New Adarsh Nagar, Jalandhar, Punjab 144002, India","https://www.google.co.kr/maps/place/Breathe+Gym,+Jalandhar/data=!4m5!3m4!1s0x391a5bb78df43529:0x14cda3adfbe83343!8m2!3d31.3272631!4d75.5611872?authuser=0&hl=en&rclk=1"
CrossFit INQUILAB,Fitness center,"SCO 38-C URBAN ESTATE PHASE 2, Jalandhar, Punjab 144003, India",https://www.google.co.kr/maps/place/CrossFit+INQUILAB/data=!4m5!3m4!1s0x391a5bbaefd812df:0x1c000b715d36eb3c!8m2!3d31.2967311!4d75.5880678?authuser=0&hl=en&rclk=1
Next Level Fitness - Best Gym & Spa in Nawanshahr,Gym,"Chandigarh Rd, Above Canara Bank, Rai Colony, Nawanshahr, Punjab 144516, India",https://www.google.co.kr/maps/place/Next+Level+Fitness+-+Best+Gym+%26+Spa+in+Nawanshahr/data=!4m5!3m4!1s0x391abc4edf7bb4e9:0xbee712f1fa4bbc49!8m2!3d31.1181913!4d76.1401865?authuser=0&hl=en&rclk=1
Concept Fitness,Gym,"Indus Ind ATM, Nehru Sidhant Kender Complex, Feroze Gandhi Market Road, Pritm Nagar, Model Town, Ludhiana, Punjab 141001, India",https://www.google.co.kr/maps/place/Concept+Fitness/data=!4m5!3m4!1s0x391a836c721b0dab:0xe4b33fa879b301d2!8m2!3d30.8909167!4d75.8413374?authuser=0&hl=en&rclk=1
Fitness Freaks,Gym,"164, Golden Ave, Part 2, Golden Avenue, Jalandhar, Punjab 144001, India",https://www.google.co.kr/maps/place/Fitness+Freaks/data=!4m5!3m4!1s0x391a5a5f309bf7cb:0x650af482d9460c00!8m2!3d31.3011199!4d75.5904141?authuser=0&hl=en&rclk=1
Body Tuner Gym,Gym,"48-B, Tagor Nagar. Opp Dr M.S. Sethi Hospital, Near Hero Heart DMC, Ludhiana, Punjab 141001, India",https://www.google.co.kr/maps/place/Body+Tuner+Gym/data=!4m5!3m4!1s0x391a83c1a0b32fe1:0xf81086d412fdb361!8m2!3d30.9103735!4d75.8240633?authuser=0&hl=en&rclk=1
Speed Fitness Unisex Gym - Best gym in Ludhiana,Gym,"Guru Nanak Dev Nagar, St. 5, Daba Lohara Rd, near Sai Dental Hospital, Shimlapuri, Ludhiana, Punjab 141008, India",https://www.google.co.kr/maps/place/Speed+Fitness+Unisex+Gym+-+Best+gym+in+Ludhiana/data=!4m5!3m4!1s0x391a83973686e259:0x5bd581d90f11879e!8m2!3d30.862254!4d75.8856419?authuser=0&hl=en&rclk=1
"NOW Health & Fitness GYM in Ludhiana | Aerobics, Weight Training, Bollywood Dance, Zumba Classes",Fitness center,"SCO 90-91 Phase 1 Market, Urban Estate Dugri, Ludhiana, Punjab 141013, India","https://www.google.co.kr/maps/place/NOW+Health+%26+Fitness+GYM+in+Ludhiana+%7C+Aerobics,+Weight+Training,+Bollywood+Dance,+Zumba+Classes/data=!4m5!3m4!1s0x391a8244e401ad57:0xf32dc1b4ed6497fa!8m2!3d30.874924!4d75.840093?authuser=0&hl=en&rclk=1"
O2 Fitness Club,Gym,"1st Floor, Mansarover Complex, 22 No. Phatak, Near City Center, Patiala, Punjab 147001, India",https://www.google.co.kr/maps/place/O2+Fitness+Club/data=!4m5!3m4!1s0x391028b90dd74953:0x90674abb5cc9646e!8m2!3d30.3423541!4d76.3793386?authuser=0&hl=en&rclk=1
Angel's fitness club,Gym,"Railway Rd, opposite Old Raj theater, Kacha Tobha, Hoshiarpur, Punjab 146001, India",https://www.google.co.kr/maps/place/Angel's+fitness+club/data=!4m5!3m4!1s0x391ae3cad69be91d:0xf88e68783401d7d5!8m2!3d31.5332738!4d75.9112923?authuser=0&hl=en&rclk=1
Super Fitness Shop,Gym,"Damoria Pul, Goal Market, Civil Lines, Ludhiana, Punjab 141008, India",https://www.google.co.kr/maps/place/Super+Fitness+Shop/data=!4m5!3m4!1s0x391a839a43c56b21:0xcef646722484eeb0!8m2!3d30.91977!4d75.84346?authuser=0&hl=en&rclk=1
Fitness Point,Gym,"7V32+85Q, Guru Teg Bahadur Colony, Mubarik Mehal Colony, Sangrur, Punjab 148001, India",https://www.google.co.kr/maps/place/Fitness+Point/data=!4m5!3m4!1s0x39105106d61fd403:0xf5485e0e8d558e72!8m2!3d30.2533481!4d75.8504891?authuser=0&hl=en&rclk=1
PUNJABI BULLS GYM,Gym,"Udham Singh Nagar, Patiala, Punjab 147004, India",https://www.google.co.kr/maps/place/PUNJABI+BULLS+GYM/data=!4m5!3m4!1s0x3910273720f11625:0x99e42a475d47ce0d!8m2!3d30.3696516!4d76.3981396?authuser=0&hl=en&rclk=1
Fitness Centre,Gym,"47HR+7X8, Muridwal, Punjab 144702, India",https://www.google.co.kr/maps/place/Fitness+Centre/data=!4m5!3m4!1s0x391a15928a2d24af:0x2c83da2efa7d34cd!8m2!3d31.1281743!4d75.2924666?authuser=0&hl=en&rclk=1
Gold's Gym,Fitness center,"G.T Road, Near McDonald's, Bullepur, Khanna, Punjab 141401, India",https://www.google.co.kr/maps/place/Gold's+Gym/data=!4m5!3m4!1s0x39101b9362be20f9:0xa18b8a58ed8a3100!8m2!3d30.684493!4d76.2562028?authuser=0&hl=en&rclk=1
T&S Fitness Gym Only Female Gaushala Road Jandiala Guru,Gym,"Jandiala Guru, Punjab 143115, India",https://www.google.co.kr/maps/place/T%26S+Fitness+Gym+Only+Female+Gaushala+Road+Jandiala+Guru/data=!4m5!3m4!1s0x391bd69e735708b9:0xae47b926ab241d22!8m2!3d31.5593974!4d75.0322863?authuser=0&hl=en&rclk=1
fitness curves gym,Gym,"Phase 1, markit, Jalandhar, Punjab 144022, India",https://www.google.co.kr/maps/place/fitness+curves+gym/data=!4m5!3m4!1s0x391a5baef43334a7:0x8dbabb0c51a516a!8m2!3d31.2895856!4d75.5958664?authuser=0&hl=en&rclk=1
Bajwa Fitness Gym,Gym,"88CP+9RR, Hussainpur, Lodhi Bholana, Punjab 144620, India",https://www.google.co.kr/maps/place/Bajwa+Fitness+Gym/data=!4m5!3m4!1s0x391a3801383789c7:0xb6f609f8b8b955e6!8m2!3d31.3209833!4d75.3370116?authuser=0&hl=en&rclk=1
Vishal's Fitness Club,Gym,"Khanuwan Rd, Near, Railway Fattak, Gurdaspur, Punjab 143521, India",https://www.google.co.kr/maps/place/Vishal's+Fitness+Club/data=!4m5!3m4!1s0x391b9268f3c4a30f:0xe65cb4db8499740a!8m2!3d32.0280047!4d75.4014461?authuser=0&hl=en&rclk=1
JAIN FITNESS WORLD,Gym,"Street Number 8, near Basant Park, opp. Lottey Kanda, Industrial Area-B, Ludhiana, Punjab 141003, India",https://www.google.co.kr/maps/place/JAIN+FITNESS+WORLD/data=!4m5!3m4!1s0x391a82e46e47c28d:0x10740974796ea13d!8m2!3d30.8848261!4d75.8630178?authuser=0&hl=en&rclk=1
The Perfect Fitness,Fitness center,"Ghuman market near HP petrol pump Bhogpur, punjab, Punjab 144201, India",https://www.google.co.kr/maps/place/The+Perfect+Fitness/data=!4m5!3m4!1s0x391bab4051ea7247:0x9b0b596c8af290b3!8m2!3d31.559782!4d75.641702?authuser=0&hl=en&rclk=1
Power Gym,Gym,"1st floor, Main Hambran Rd, opp. rishi nagar, Near Kali Mata Mandir, Haibowal Khurd, Haibowal Kalan, Ludhiana, Punjab 141001, India",https://www.google.co.kr/maps/place/Power+Gym/data=!4m5!3m4!1s0x391a81584db09de1:0xed89ae53c2d6d469!8m2!3d30.9171192!4d75.8038366?authuser=0&hl=en&rclk=1
Ghuman Fitness Gym & Dance Academy,Gym,"Jalandhar Road, near Burger Bar, Jandiala Manjki, Punjab 144033, India",https://www.google.co.kr/maps/place/Ghuman+Fitness+Gym+%26+Dance+Academy/data=!4m5!3m4!1s0x391a67e589f88c87:0xbda82c3b5c8e6dcb!8m2!3d31.1641831!4d75.6166453?authuser=0&hl=en&rclk=1
B1GYM,Gym,"Pathankot - Jalandhar Rd, Sanghwal, Punjab 144301, India",https://www.google.co.kr/maps/place/B1GYM/data=!4m5!3m4!1s0x391a57d02e0b2f8b:0x817e8d8fc20da746!8m2!3d31.4338764!4d75.6209866?authuser=0&hl=en&rclk=1
Body Fit Line,Gym,"21, Sunder Vihar, Wariana Complex, Punjab 144001, India",https://www.google.co.kr/maps/place/Body+Fit+Line/data=!4m5!3m4!1s0x391a4553ebaedce1:0x5a7006ef18f399b6!8m2!3d31.3403315!4d75.5229434?authuser=0&hl=en&rclk=1
PRO Fitness Gym Bathinda-Best Gym In Bathinda,Gym,"First Floor, PRO FITNESS GYM, Amrik Singh Rd, opp. S.S.D. Girls College, Bathinda, Punjab 151001, India",https://www.google.co.kr/maps/place/PRO+Fitness+Gym+Bathinda-Best+Gym+In+Bathinda/data=!4m5!3m4!1s0x39173293178300a3:0x479029adfd4b1162!8m2!3d30.2225289!4d74.9363323?authuser=0&hl=en&rclk=1
GYM TOWN,Gym,"B-XIV-2560, opposite A.V.M SCHOOL, Near Mini Rose Garden, Ajit Nagar, Ludhiana, Punjab 141008, India",https://www.google.co.kr/maps/place/GYM+TOWN/data=!4m5!3m4!1s0x391a830fd7477fa7:0xe024958a8c98e561!8m2!3d30.9057769!4d75.8646353?authuser=0&hl=en&rclk=1
Unique fitness Gym,Gym,"Gali Number 1, Adarsh Nagar, Bathinda, Punjab 151003, India",https://www.google.co.kr/maps/place/Unique+fitness+Gym/data=!4m5!3m4!1s0x39173311a78734d3:0x63e333d7fcd63b43!8m2!3d30.2609113!4d74.9354985?authuser=0&hl=en&rclk=1
Fitness Center,Gym,"6FC6+64Q, Rasulpur Kalan, Punjab 144623, India",https://www.google.co.kr/maps/place/Fitness+Center/data=!4m5!3m4!1s0x391a4330b1ef8e79:0xc44dfa34b1af0039!8m2!3d31.2205795!4d75.4603547?authuser=0&hl=en&rclk=1
Aryan Body Gym,Gym,"Nadala, Punjab 144624, India",https://www.google.co.kr/maps/place/Aryan+Body+Gym/data=!4m5!3m4!1s0x391bb363eaaaaaab:0xd42e9be4907bc9ef!8m2!3d31.5436013!4d75.4368046?authuser=0&hl=en&rclk=1
LEO FITNESS CLUB,Gym,"#400, GURU NANAK NAGAR, GULAB DEVI-NAGRA ROAD, NR, Durga Mandir Road, Jalandhar, Punjab 144013, India",https://www.google.co.kr/maps/place/LEO+FITNESS+CLUB/data=!4m5!3m4!1s0x391a5bf6dd4faf97:0xc8999e91a6465e49!8m2!3d31.348338!4d75.548743?authuser=0&hl=en&rclk=1
Gold's Gym,Gym,"Gold's Gym, Una Rd, Jattan Mohalla, Hoshiarpur, Punjab 146001, India",https://www.google.co.kr/maps/place/Gold's+Gym/data=!4m5!3m4!1s0x391ae3631d24fbf7:0x1a879d8f6a21429a!8m2!3d31.5398363!4d75.9198693?authuser=0&hl=en&rclk=1
Raw Fitness Gym,Gym,"15/16 Top Floor Nehru Complex Lawrence Road, Amritsar, Punjab 143001, India",https://www.google.co.kr/maps/place/Raw+Fitness+Gym/data=!4m5!3m4!1s0x3919635855a0538b:0xc9e66aecf4d269f3!8m2!3d31.6423563!4d74.8768468?authuser=0&hl=en&rclk=1
The Fitness Infusion - Best Fitness Studio in Jalandhar | Best Dance Academy for Kids in Jalandhar,Gym,"House no 10 Tower Enclave phase no-2, near, APS School, Jalandhar, Punjab 144003, India",https://www.google.co.kr/maps/place/The+Fitness+Infusion+-+Best+Fitness+Studio+in+Jalandhar+%7C+Best+Dance+Academy+for+Kids+in+Jalandhar/data=!4m5!3m4!1s0x391a5b8dca1cfc81:0xb0234069f89942c7!8m2!3d31.2898508!4d75.5469673?authuser=0&hl=en&rclk=1
Shah's Fitness Gym,Gym,"Saili Rd, Rose Avenue, Aman Vihar, Pathankot, Punjab 145001, India",https://www.google.co.kr/maps/place/Shah's+Fitness+Gym/data=!4m5!3m4!1s0x391c7f7fa381bb83:0x81a24a77854cd419!8m2!3d32.2667238!4d75.6584594?authuser=0&hl=en&rclk=1
